webpage,id,slug,title,state,sharing,createdAt,updatedAt,licence,licence_notes,publisher,featured_dataset,author,author_email,maintainer,maintainer_email,update_frequency,odi-certificate,tags,topic-business-and-economy,topic-championing-london,topic-crime-and-community-safety,topic-demographics,topic-education,topic-employment-and-skills,topic-environment,topic-health,topic-housing,topic-art-and-culture,topic-london-2012,topic-planning,topic-sport,topic-transparency,topic-transport,topic-young-people,topic-income-poverty-welfare,parent,london_smallest_geography,london_bounding_box
https://data.london.gov.uk/dataset/local-units-broad-industry-group-borough,76eb27c2-691a-42c8-b588-681f1ea6dbcb,local-units-broad-industry-group-borough,"Local Units by Broad Industry Group, Borough",active,public,23-Oct-13,17-Oct-18,UK Open Government Licence (OGL v2),,Office for National Statistics (ONS),,Office for National Statistics,,Opinion Research and General Statistics (GLA),datastore@london.gov.uk,Annually,https://certificates.theodi.org/datasets/22767/certificate,"redbridge, merton, enfield, local-units, tower-hamlets, havering, hammersmith-and-fulham, business, westminster, haringey, city-of-london, camden, hackney, bromley, greenwich, newham, kingston-upon-thames, islington, ealing, harrow, croydon, broad-industry-group, wandsworth, southwark, vat, paye, bexley, waltham-forest, kensington-and-chelsea, sutton, lambeth, barking-and-dagenham, hillingdon, brent, barnet, richmond-upon-thames, hounslow, idbr, lewisham",TRUE,FALSE,FALSE,FALSE,FALSE,FALSE,FALSE,FALSE,FALSE,FALSE,FALSE,FALSE,FALSE,FALSE,FALSE,FALSE,FALSE,2b9d2485-1e5a-4b9b-922c-a2a4d42a864a,Local Authority,Greater London
https://data.london.gov.uk/dataset/local-units-employment-size-borough,9cf2ab73-feeb-4774-b8ff-791a0c76144a,local-units-employment-size-borough,"Local Units and Enterprises by Employment Size, Borough",active,public,14-Apr-14,17-Oct-18,UK Open Government Licence (OGL v2),,Office for National Statistics (ONS),,Office for National Statistics,,Opinion Research and General Statistics (GLA),datastore@london.gov.uk,Annually,https://certificates.theodi.org/datasets/22769/certificate,"employment, enterprises, idbr, employees, sizeband, local-units, employee, business, paye, sme, vat, size, micro",TRUE,FALSE,FALSE,FALSE,FALSE,FALSE,FALSE,FALSE,FALSE,FALSE,FALSE,FALSE,FALSE,FALSE,FALSE,FALSE,FALSE,2b9d2485-1e5a-4b9b-922c-a2a4d42a864a,Local Authority,Greater London
https://data.london.gov.uk/dataset/vat-enterprises-turnover-size-borough,32d9deac-ccd7-48cc-ba9a-6ed9f6a121f2,vat-enterprises-turnover-size-borough,"VAT Enterprises by Turnover Size, Borough",active,public,10-Apr-14,17-Oct-18,UK Open Government Licence (OGL v2),,Office for National Statistics (ONS),,Office for National Statistics,,Opinion Research and General Statistics (GLA),datastore@london.gov.uk,Annually,https://certificates.theodi.org/datasets/23196/certificate,"business, vat, paye, enterprise, turnover",TRUE,FALSE,FALSE,FALSE,FALSE,FALSE,FALSE,FALSE,FALSE,FALSE,FALSE,FALSE,FALSE,FALSE,FALSE,FALSE,FALSE,2b9d2485-1e5a-4b9b-922c-a2a4d42a864a,Local Authority,Greater London
https://data.london.gov.uk/dataset/area-designated-green-belt-land,bce6eadb-b49e-4f90-a13d-581d092e233c,area-designated-green-belt-land,Area of Designated Green Belt Land,active,public,13-Mar-14,16-Oct-18,UK Open Government Licence (OGL v2),,"Ministry of Housing, Communities & Local Government (MHCLG)",,Department for Communities and Local Government,,Opinion Research and General Statistics (GLA),datastore@london.gov.uk,Annually,https://certificates.theodi.org/datasets/23220/certificate,"greenbelt, southwark, hounslow, sustainability, harrow, camden, environment, havering, richmond-upon-thames, westminster, ealing, haringey, greenwich, croydon, newham, hackney, kingston-upon-thames, hillingdon, islington, bromley, tower-hamlets, redbridge, city-of-london, lambeth, hammersmith-and-fulham, brent, barking-and-dagenham, wandsworth, sutton, enfield, kensington-and-chelsea, waltham-forest, planning, merton, bexley, barnet, lewisham, development",FALSE,FALSE,FALSE,FALSE,FALSE,FALSE,TRUE,FALSE,FALSE,FALSE,FALSE,TRUE,FALSE,FALSE,FALSE,FALSE,FALSE,8070677a-2a67-4103-9cf6-d7764d1a9593,Local Authority,Greater London
https://data.london.gov.uk/dataset/homelessness,7d712e1f-07dd-4107-83a2-62d7e12aa89c,homelessness,"Homelessness Provision, Borough",active,public,02-Feb-10,12-Oct-18,UK Open Government Licence (OGL v2),,"Ministry of Housing, Communities & Local Government (MHCLG)",,Department for Communities and Local Government,,Opinion Research and General Statistics (GLA),datastore@london.gov.uk,Annually,https://certificates.theodi.org/datasets/23093/certificate,"homelessness, housing, economic-fairness",FALSE,FALSE,FALSE,FALSE,FALSE,FALSE,FALSE,FALSE,TRUE,FALSE,FALSE,FALSE,FALSE,FALSE,FALSE,FALSE,FALSE,8070677a-2a67-4103-9cf6-d7764d1a9593,Local Authority,Greater London
https://data.london.gov.uk/dataset/births-birthplace-mother-borough,0857b570-d9d0-431e-a76e-ec7e425fffd5,births-birthplace-mother-borough,"Births by Birthplace of Mother, Borough",active,public,01-Sep-13,12-Oct-18,UK Open Government Licence (OGL v2),,Office for National Statistics (ONS),,Office for National Statistics,,Opinion Research and General Statistics (GLA),datastore@london.gov.uk,Annually,https://certificates.theodi.org/datasets/23305/certificate,"migration, health, country-of-birth, births",FALSE,FALSE,FALSE,TRUE,FALSE,FALSE,FALSE,FALSE,FALSE,FALSE,FALSE,FALSE,FALSE,FALSE,FALSE,FALSE,FALSE,2b9d2485-1e5a-4b9b-922c-a2a4d42a864a,Local Authority,Greater London
https://data.london.gov.uk/dataset/wealth-inequality,d0acc7c9-8c78-4589-81e4-a7fc721c40ea,wealth-inequality,Wealth Inequality,active,public,27-Jun-18,11-Oct-18,UK Open Government Licence (OGL v3),,Office for National Statistics (ONS),,Office for National Statistics (ONS),,Greater London Authority (GLA),datastore@london.gov.uk,Annually,,economic-fairness,TRUE,FALSE,FALSE,FALSE,FALSE,FALSE,FALSE,FALSE,FALSE,FALSE,FALSE,FALSE,FALSE,FALSE,FALSE,FALSE,TRUE,2b9d2485-1e5a-4b9b-922c-a2a4d42a864a,Greater London,
https://data.london.gov.uk/dataset/apprenticeships-starts-and-completions-region-and-local-authority,5fcceb2e-1ceb-4b77-b86f-1f760a4c0db2,apprenticeships-starts-and-completions-region-and-local-authority,"Apprenticeships Starts and Completions, Region and Local Authority",active,public,18-Sep-14,10-Oct-18,Creative Commons Attribution,,Department for Education,,,,Opinion Research and General Statistics (GLA),datastore@london.gov.uk,Biannually,,"apprenticeships, the-data-service, young-people, jobs, economic-fairness",FALSE,FALSE,FALSE,FALSE,FALSE,TRUE,FALSE,FALSE,FALSE,FALSE,FALSE,FALSE,FALSE,FALSE,FALSE,TRUE,FALSE,f1e2d47c-3d52-4413-b376-ba05a0d00bfa,Local Authority,England
https://data.london.gov.uk/dataset/gla-poll-results-2017,9dc2ec3e-5811-499e-9903-caf8a812465d,gla-poll-results-2017,GLA Poll Results 2017,active,public,01-Jan-17,10-Oct-18,UK Open Government Licence (OGL v3),,Greater London Authority (GLA),,Greater London Authority,,Opinion Research and General Statistics (GLA),datastore@london.gov.uk,,,,FALSE,FALSE,FALSE,FALSE,FALSE,FALSE,FALSE,FALSE,FALSE,FALSE,FALSE,FALSE,FALSE,TRUE,FALSE,FALSE,FALSE,5b858cb2-5c92-4b2b-8c1d-141cfc330d9c,Greater London,
https://data.london.gov.uk/dataset/current-issues-note-40-performance-of-gla-economics-employment-projections,8d2908af-2af7-42e3-ab6e-8175ea348f4b,current-issues-note-40-performance-of-gla-economics-employment-projections,Current Issues Note 40: Performance of GLA Economics' employment projections,active,public,01-Oct-14,09-Oct-18,Creative Commons Attribution,,Greater London Authority (GLA),,,,GLA Economics,,Ad hoc,,,TRUE,FALSE,FALSE,FALSE,FALSE,FALSE,FALSE,FALSE,FALSE,FALSE,FALSE,FALSE,FALSE,FALSE,FALSE,FALSE,FALSE,5b858cb2-5c92-4b2b-8c1d-141cfc330d9c,,
https://data.london.gov.uk/dataset/domestic-energy-efficiency-ratings-borough,7c6567bc-6b0b-4c88-a7d1-418d53a44437,domestic-energy-efficiency-ratings-borough,"Domestic Energy Efficiency Ratings, Borough",active,public,21-May-15,08-Oct-18,UK Open Government Licence (OGL v3),,"Ministry of Housing, Communities & Local Government (MHCLG)",,DCLG,,Opinion Research and General Statistics (GLA),datastore@london.gov.uk,Quarterly,,"domestic, energy, co2, floorspace, ratings, economic-fairness",FALSE,FALSE,FALSE,FALSE,FALSE,FALSE,TRUE,FALSE,FALSE,FALSE,FALSE,FALSE,FALSE,FALSE,FALSE,FALSE,FALSE,8070677a-2a67-4103-9cf6-d7764d1a9593,Local Authority,
https://data.london.gov.uk/dataset/london-s-housing-pipeline-as-at-31-03-2016-from-amr13,88eaa962-37d1-4f07-a94f-6ea04a31e066,london-s-housing-pipeline-as-at-31-03-2016-from-amr13,London’s housing data from AMR13,active,public,08-Dec-17,05-Oct-18,UK Open Government Licence (OGL v3),,Greater London Authority (GLA),,Planning Data Team,ldd@london.gov.uk,Planning data team,ldd@london.gov.uk,,,,FALSE,FALSE,FALSE,FALSE,FALSE,FALSE,FALSE,FALSE,TRUE,FALSE,FALSE,TRUE,FALSE,FALSE,FALSE,FALSE,FALSE,5b858cb2-5c92-4b2b-8c1d-141cfc330d9c,Point Location,
https://data.london.gov.uk/dataset/london-plan-amr14-tables-and-data,6fd911cb-2a2e-47c6-91b3-edaf46906c79,london-plan-amr14-tables-and-data,London Plan AMR14 Tables and Data,active,public,05-Oct-18,05-Oct-18,UK Open Government Licence (OGL v3),,Greater London Authority (GLA),,Planning Data Team,ldd@london.gov.uk,Planning Data Team,ldd@london.gov.uk,One off,,"housing, planning, london plan",FALSE,FALSE,FALSE,FALSE,FALSE,FALSE,FALSE,FALSE,FALSE,FALSE,FALSE,TRUE,FALSE,FALSE,FALSE,FALSE,FALSE,5b858cb2-5c92-4b2b-8c1d-141cfc330d9c,Point Location,
https://data.london.gov.uk/dataset/qualifications-economically-active-population-gender-borough,d7f0d893-e531-4b0b-85d7-e6f5e5ffbb31,qualifications-economically-active-population-gender-borough,"Qualifications by Economic Activity Status, Borough",active,public,17-Jul-14,02-Oct-18,UK Open Government Licence (OGL v2),,Office for National Statistics (ONS),,Office for National Statistics,,Opinion Research and General Statistics (GLA),datastore@london.gov.uk,Annually,https://certificates.theodi.org/datasets/22918/certificate,"economic-activity, nvq, education, qualifications, Economic Activity, Qualifications, unemployed, employed, inactivity, skills, working-age, workless, NVQ, sex",FALSE,FALSE,FALSE,FALSE,TRUE,TRUE,FALSE,FALSE,FALSE,FALSE,FALSE,FALSE,FALSE,FALSE,FALSE,FALSE,FALSE,2b9d2485-1e5a-4b9b-922c-a2a4d42a864a,Local Authority,Greater London
https://data.london.gov.uk/dataset/consumption-other-fuels-borough,b49b7ba7-614b-415f-92aa-9602215a9895,consumption-other-fuels-borough,"Consumption of Other Fuels, Borough",active,public,20-Nov-13,02-Oct-18,UK Open Government Licence (OGL v2),,"Department for Business, Energy & Industrial Strategy (BEIS)",,"Department for Business, Energy & Industrial Strategy (BEIS)",,Opinion Research and General Statistics (GLA),datastore@london.gov.uk,Annually,https://certificates.theodi.org/datasets/23261/certificate,"electricity, consumption, energy, resources, other-fuels",FALSE,FALSE,FALSE,FALSE,FALSE,FALSE,TRUE,FALSE,FALSE,FALSE,FALSE,FALSE,FALSE,FALSE,FALSE,FALSE,FALSE,c331fd34-b8ba-4888-83f4-4f23cbcca974,Local Authority,Greater London
https://data.london.gov.uk/dataset/granted-british-citizenship,5575ee72-74c8-4cf6-9aff-a14d4e3efb9b,granted-british-citizenship,Granted British Citizenship,active,public,01-Oct-13,26-Sep-18,UK Open Government Licence (OGL v2),,Home Office,,Home Office,,Opinion Research and General Statistics (GLA),datastore@london.gov.uk,Ad hoc,https://certificates.theodi.org/datasets/23302/certificate,"demography, british, migration, citizenship",FALSE,FALSE,FALSE,TRUE,FALSE,FALSE,FALSE,FALSE,FALSE,FALSE,FALSE,FALSE,FALSE,FALSE,FALSE,FALSE,FALSE,68fcd695-8856-49d2-86af-9f981d43f36a,Local Authority,Greater London 
https://data.london.gov.uk/dataset/immunisation-rates-children-1st-2nd-and-5th-birthdays,46480752-e568-4ead-9734-4a95e5996b1a,immunisation-rates-children-1st-2nd-and-5th-birthdays,"Immunisation Rates for Children at 1st, 2nd and 5th Birthdays",active,public,26-Jun-14,25-Sep-18,UK Open Government Licence (OGL v2),,Department of Health,,Department of Health,,Opinion Research and General Statistics (GLA),datastore@london.gov.uk,Annually,https://certificates.theodi.org/datasets/23158/certificate,"health, immunised, menc, diptheria, pneumococcal-disease, disease, hib, 1st, young-people, children, polio, immunisations, tetanus, pertussis, nhs",FALSE,FALSE,FALSE,FALSE,FALSE,FALSE,FALSE,TRUE,FALSE,FALSE,FALSE,FALSE,FALSE,FALSE,FALSE,TRUE,FALSE,248b2a9f-74b6-4667-a173-4e92c1203a68,Primary Care Organisations,Greater London
https://data.london.gov.uk/dataset/personal-insolvency-statistics-borough,577bd2ab-184b-4f0f-b74a-f3b8d40443df,personal-insolvency-statistics-borough,"Personal Insolvency Statistics, Borough",active,public,15-Apr-14,20-Sep-18,UK Open Government Licence (OGL v2),,The Insolvency Service,,Insolvency Service,,Opinion Research and General Statistics (GLA),datastore@london.gov.uk,Annually,https://certificates.theodi.org/datasets/23184/certificate,"individual-voluntary-arrangements, bankruptcy, deprivation, iva, debt, poverty, insolvency, economic-fairness",FALSE,FALSE,FALSE,FALSE,FALSE,TRUE,FALSE,FALSE,FALSE,FALSE,FALSE,FALSE,FALSE,FALSE,FALSE,FALSE,FALSE,9ae8a86a-f4e4-4781-88e5-30557dfe6b51,Local Authority,Greater London
https://data.london.gov.uk/dataset/adults-with-access-to-bank-accounts,ad9b8d3e-2432-4203-8683-5f1d6df37882,adults-with-access-to-bank-accounts,Adults with access to bank accounts,active,public,18-Sep-18,20-Sep-18,UK Open Government Licence (OGL v3),,Department for Work and Pensions,,Department for Work and Pensions (DWP),,Greater London Authority (GLA),datastore@london.gov.uk,,,economic-fairness,FALSE,FALSE,FALSE,FALSE,FALSE,FALSE,FALSE,FALSE,FALSE,FALSE,FALSE,FALSE,FALSE,FALSE,FALSE,FALSE,TRUE,0b8c2363-5766-42fb-9191-1f1f6dd0c74d,,
https://data.london.gov.uk/dataset/families-unable-to-meet-unexpected-bills,a6ab118b-789e-4fa7-a29e-487566f59cf2,families-unable-to-meet-unexpected-bills,Families unable to meet unexpected bills,active,public,18-Sep-18,20-Sep-18,UK Open Government Licence (OGL v3),,Department for Work and Pensions,,Department for Work and Pensions (DWP),,Greater London Authority (GLA),datastore@london.gov.uk,,,economic-fairness,FALSE,FALSE,FALSE,FALSE,FALSE,FALSE,FALSE,FALSE,FALSE,FALSE,FALSE,FALSE,FALSE,FALSE,FALSE,FALSE,TRUE,0b8c2363-5766-42fb-9191-1f1f6dd0c74d,,
https://data.london.gov.uk/dataset/families-with-savings-under-1500,c6252972-026c-459e-9059-bcc9679e7b8c,families-with-savings-under-1500,Families with savings under £1500,active,public,18-Sep-18,20-Sep-18,UK Open Government Licence (OGL v3),,Department for Work and Pensions,,Department for Work and Pensions,,Greater London Authority (GLA),datastore@london.gov.uk,,,economic-fairness,FALSE,FALSE,FALSE,FALSE,FALSE,FALSE,FALSE,FALSE,FALSE,FALSE,FALSE,FALSE,FALSE,FALSE,FALSE,FALSE,TRUE,0b8c2363-5766-42fb-9191-1f1f6dd0c74d,Region,
https://data.london.gov.uk/dataset/problem-debt,f258fe89-6c80-4966-a927-4f94dd8b6ca9,problem-debt,Problem Debt,active,public,12-Sep-18,20-Sep-18,UK Open Government Licence (OGL v3),,Department for Work and Pensions,,Department for Work and Pensions (DWP),,Greater London Authority (GLA),datastore@london.gov.uk,,,economic-fairness,FALSE,FALSE,FALSE,FALSE,FALSE,FALSE,FALSE,FALSE,FALSE,FALSE,FALSE,FALSE,FALSE,FALSE,FALSE,FALSE,TRUE,0b8c2363-5766-42fb-9191-1f1f6dd0c74d,Greater London,
https://data.london.gov.uk/dataset/ethnicity-pay-gaps,03140c41-be00-40cd-94ee-b60bbcc54172,ethnicity-pay-gaps,Ethnicity Pay Gaps in London,active,public,19-Jun-18,20-Sep-18,UK Open Government Licence (OGL v3),,Greater London Authority (GLA),,,,Greater London Authority,datastore@london.gov.uk,Annually,,economic-fairness,TRUE,FALSE,FALSE,FALSE,FALSE,TRUE,FALSE,FALSE,FALSE,FALSE,FALSE,FALSE,FALSE,TRUE,FALSE,FALSE,FALSE,5b858cb2-5c92-4b2b-8c1d-141cfc330d9c,Greater London,
https://data.london.gov.uk/dataset/fuel-poverty,85b71fc6-1fe3-4588-90a6-3455330c1ef1,fuel-poverty,Fuel Poverty,active,public,12-Sep-18,20-Sep-18,UK Open Government Licence (OGL v3),,Greater London Authority (GLA),,Office for National Statistics (ONS),,Greater London Authority (GLA),datastore@london.gov.uk,Annually,,economic-fairness,FALSE,FALSE,FALSE,FALSE,FALSE,TRUE,TRUE,FALSE,FALSE,FALSE,FALSE,FALSE,FALSE,FALSE,FALSE,FALSE,FALSE,5b858cb2-5c92-4b2b-8c1d-141cfc330d9c,Greater London,
https://data.london.gov.uk/dataset/average-childcare-costs-in-london,d11c9179-f7e8-4306-96e4-f73071210af6,average-childcare-costs-in-london,Average Childcare Costs in London,active,public,15-Jun-18,20-Sep-18,UK Open Government Licence (OGL v3),,Family and Childcare Trust,,Family and Childcare Trust,,Greater London Authority,datastore@london.gov.uk,Annually,,economic-fairness,FALSE,FALSE,FALSE,FALSE,FALSE,FALSE,FALSE,FALSE,FALSE,FALSE,FALSE,FALSE,FALSE,FALSE,FALSE,FALSE,TRUE,39ce9f6e-1ab1-4664-acc9-d6c1a1bd63d2,Greater London,
https://data.london.gov.uk/dataset/young-people-not-employment-education-or-training-borough,2844b83d-0b94-4219-95dd-0ba21ae21a05,young-people-not-employment-education-or-training-borough,"Young People Not in Employment, Education or Training, Borough",active,public,22-Sep-14,20-Sep-18,UK Open Government Licence (OGL v2),https://www.gov.uk/government/collections/statistics-neet,Department for Education,,Department for Education,,Opinion Research and General Statistics (GLA),datastore@london.gov.uk,Monthly,https://certificates.theodi.org/datasets/22842/certificate,"youth, young-people, nuts3, neet, nuts2, neets, economic-fairness",FALSE,FALSE,FALSE,FALSE,FALSE,TRUE,FALSE,FALSE,FALSE,FALSE,FALSE,FALSE,FALSE,FALSE,FALSE,TRUE,FALSE,f1e2d47c-3d52-4413-b376-ba05a0d00bfa,Local Authority,Greater London
https://data.london.gov.uk/dataset/labour-force-with-no-or-low-qualifications,c22e3f78-619d-44b1-833a-bf7bf8d3427d,labour-force-with-no-or-low-qualifications,Labour force with no or low qualifications,active,public,11-Jun-18,20-Sep-18,UK Open Government Licence (OGL v3),,Office for National Statistics (ONS),,Office for National Statistics (ONS),,Greater London Authority (GLA),datastore@london.gov.uk,Annually,,economic-fairness,TRUE,FALSE,FALSE,FALSE,FALSE,TRUE,FALSE,FALSE,FALSE,FALSE,FALSE,FALSE,FALSE,FALSE,FALSE,FALSE,FALSE,2b9d2485-1e5a-4b9b-922c-a2a4d42a864a,Greater London,
https://data.london.gov.uk/dataset/underutility,dac23403-905f-4e95-840a-a9db825b48c6,underutility,Underutility,active,public,12-Sep-18,20-Sep-18,UK Open Government Licence (OGL v3),,Office for National Statistics (ONS),,Office for National Statistics (ONS),,Greater London Authority (GLA),datastore@london.gov.uk,Annually,,economic-fairness,TRUE,FALSE,FALSE,FALSE,FALSE,TRUE,FALSE,FALSE,FALSE,FALSE,FALSE,FALSE,FALSE,FALSE,FALSE,FALSE,FALSE,2b9d2485-1e5a-4b9b-922c-a2a4d42a864a,,
https://data.london.gov.uk/dataset/workers-on-zero-hours-contracts,c297f8fa-6f81-4475-b575-d0e6d2b492a8,workers-on-zero-hours-contracts,Workers on Zero Hours Contracts,active,public,12-Sep-18,20-Sep-18,UK Open Government Licence (OGL v3),,Office for National Statistics (ONS),,Office for National Statistics (ONS),,Greater London Authority (GLA),datastore@london.gov.uk,Annually,,economic-fairness,TRUE,FALSE,FALSE,FALSE,FALSE,TRUE,FALSE,FALSE,FALSE,FALSE,FALSE,FALSE,FALSE,FALSE,FALSE,FALSE,FALSE,2b9d2485-1e5a-4b9b-922c-a2a4d42a864a,Greater London,
https://data.london.gov.uk/dataset/overemployment,1e4f826d-f2c2-4a8e-824f-c335b3e0d6da,overemployment,Overemployment,active,public,12-Sep-18,20-Sep-18,UK Open Government Licence (OGL v3),,Office for National Statistics (ONS),,Office for National Statistics (ONS),,Greater London Authority,datastore@london.gov.uk,Annually,,economic-fairness,TRUE,FALSE,FALSE,FALSE,FALSE,TRUE,FALSE,FALSE,FALSE,FALSE,FALSE,FALSE,FALSE,FALSE,FALSE,FALSE,FALSE,2b9d2485-1e5a-4b9b-922c-a2a4d42a864a,Greater London,
https://data.london.gov.uk/dataset/pay-ratio-of-highest-earner-to-median-earner,e532258e-4c2f-4f56-873a-31b830e7e131,pay-ratio-of-highest-earner-to-median-earner,Pay ratio of highest earner to median earner,active,public,12-Jun-18,20-Sep-18,UK Open Government Licence (OGL v3),,Greater London Authority (GLA),,Greater London Authority,datastore@london.gov.uk,Greater London Authority,datastore@london.gov.uk,Annually,,economic-fairness,TRUE,FALSE,FALSE,FALSE,FALSE,TRUE,FALSE,FALSE,FALSE,FALSE,FALSE,FALSE,FALSE,FALSE,FALSE,FALSE,FALSE,5b858cb2-5c92-4b2b-8c1d-141cfc330d9c,Greater London,
https://data.london.gov.uk/dataset/disability-pay-gaps,57ebbc56-5497-41e9-a7d3-b9f66cd2dc93,disability-pay-gaps,Disability Pay Gaps in London,active,public,25-Jun-18,20-Sep-18,UK Open Government Licence (OGL v3),,Greater London Authority (GLA),,,,Greater London Authority,datastore@london.gov.uk,Annually,,economic-fairness,TRUE,FALSE,FALSE,FALSE,FALSE,TRUE,FALSE,FALSE,FALSE,FALSE,FALSE,FALSE,FALSE,TRUE,FALSE,FALSE,FALSE,5b858cb2-5c92-4b2b-8c1d-141cfc330d9c,Greater London,
https://data.london.gov.uk/dataset/percent-receiving-training-in-last-3-months,2dc28b5c-21d9-4473-8248-9d46a2ed2064,percent-receiving-training-in-last-3-months,Percent receiving training in last 3 months,active,public,11-Jun-18,20-Sep-18,UK Open Government Licence (OGL v3),,Office for National Statistics (ONS),,Office for National Statistics (ONS),,Greater London Authority (GLA),datastore@london.gov.uk,Annually,,economic-fairness,TRUE,FALSE,FALSE,FALSE,FALSE,TRUE,FALSE,FALSE,FALSE,FALSE,FALSE,FALSE,FALSE,FALSE,FALSE,FALSE,FALSE,2b9d2485-1e5a-4b9b-922c-a2a4d42a864a,Greater London,
https://data.london.gov.uk/dataset/employment-rates-of-parents,b97b5a0b-6fdb-417a-bf85-9724d5f96bf6,employment-rates-of-parents,Employment Rates of Parents,active,public,11-Jun-18,20-Sep-18,UK Open Government Licence (OGL v3),,Office for National Statistics (ONS),,Office for National Statistics (ONS),,Greater London Authority (GLA),datastore@london.gov.uk,Annually,,economic-fairness,FALSE,FALSE,FALSE,FALSE,FALSE,TRUE,FALSE,FALSE,FALSE,FALSE,FALSE,FALSE,FALSE,FALSE,FALSE,FALSE,FALSE,2b9d2485-1e5a-4b9b-922c-a2a4d42a864a,Greater London,
https://data.london.gov.uk/dataset/underemployment,167bbf7b-f08e-4e40-9ddd-9edf1482e5a5,underemployment,Underemployment,active,public,26-Jun-18,20-Sep-18,UK Open Government Licence (OGL v3),,Office for National Statistics (ONS),,Office for National Statistics (ONS),,Greater London Authority (GLA),datastore@london.gov.uk,Annually,,economic-fairness,TRUE,FALSE,FALSE,FALSE,FALSE,TRUE,FALSE,FALSE,FALSE,FALSE,FALSE,FALSE,FALSE,FALSE,FALSE,FALSE,FALSE,2b9d2485-1e5a-4b9b-922c-a2a4d42a864a,Greater London,
https://data.london.gov.uk/dataset/insecure-employment,8c7034ed-66c0-491c-8163-db46ab889762,insecure-employment,Insecure Employment,active,public,12-Jun-18,20-Sep-18,UK Open Government Licence (OGL v3),,Office for National Statistics (ONS),,Office for National Statistics (ONS),,Greater London Authority (GLA),datastore@london.gov.uk,Annually,,economic-fairness,TRUE,FALSE,FALSE,FALSE,FALSE,TRUE,FALSE,FALSE,FALSE,FALSE,FALSE,FALSE,FALSE,FALSE,FALSE,FALSE,FALSE,2b9d2485-1e5a-4b9b-922c-a2a4d42a864a,Greater London,
https://data.london.gov.uk/dataset/fire-facts--fire-deaths-in-greater-london,88294579-946d-4692-931f-34fe430012f9,fire-facts--fire-deaths-in-greater-london,Fire Facts: Fatal fires in Greater London,active,public,29-Aug-18,10-Sep-18,UK Open Government Licence (OGL v3),,London Fire Brigade,,Andrew Mobbs,andrew.mobbs@london-fire.gov.uk,David Wyatt,david.wyatt@london-fire.gov.uk,Annually,,"demography, fire, fire death, gender, ethnicity",FALSE,FALSE,TRUE,FALSE,FALSE,FALSE,FALSE,FALSE,FALSE,FALSE,FALSE,FALSE,FALSE,TRUE,FALSE,FALSE,FALSE,ed9dfa59-ec53-443f-a843-15b216b65288,Local Authority,
https://data.london.gov.uk/dataset/primary-fires-in-schools-in-london,5cb32454-39cd-4ca1-9621-eea2834fd6a4,primary-fires-in-schools-in-london,Primary fires in schools in London,active,public,05-Sep-18,07-Sep-18,UK Open Government Licence (OGL v3),,London Fire Brigade,,David Wyatt,david.wyatt@london-fire.gov.uk,David Wyatt,david.wyatt@london-fire.gov.uk,Annually,,"fire, schools, LFB, London Fire Brigade",FALSE,FALSE,TRUE,FALSE,FALSE,FALSE,FALSE,FALSE,FALSE,FALSE,FALSE,FALSE,FALSE,TRUE,FALSE,FALSE,FALSE,ed9dfa59-ec53-443f-a843-15b216b65288,Point Location,
https://data.london.gov.uk/dataset/health-inequalities-strategy-consultation-2017,a5c35ea9-58ec-4913-b967-a8481e0d967c,health-inequalities-strategy-consultation-2017,Health Inequalities Strategy Consultation 2017,active,public,03-Sep-18,06-Sep-18,UK Open Government Licence (OGL v3),,Greater London Authority (GLA),,Greater London Authority,datastore@london.gov.uk,Greater London Authority,datastore@london.gov.uk,One off,,,FALSE,FALSE,FALSE,FALSE,FALSE,FALSE,FALSE,TRUE,FALSE,FALSE,FALSE,FALSE,FALSE,TRUE,FALSE,FALSE,FALSE,5b858cb2-5c92-4b2b-8c1d-141cfc330d9c,,
https://data.london.gov.uk/dataset/percentage-population-religion-borough,bb15c8c9-b72d-4bba-89c2-3bd93795b09c,percentage-population-religion-borough,"Population by Religion, Borough",active,public,18-Sep-14,05-Sep-18,UK Open Government Licence (OGL v2),,Office for National Statistics (ONS),,Office for National Statistics,,Opinion Research and General Statistics (GLA),datastore@london.gov.uk,Annually,https://certificates.theodi.org/datasets/22844/certificate,"religion, diversity, faith",FALSE,FALSE,FALSE,TRUE,FALSE,FALSE,FALSE,FALSE,FALSE,FALSE,FALSE,FALSE,FALSE,FALSE,FALSE,FALSE,FALSE,2b9d2485-1e5a-4b9b-922c-a2a4d42a864a,Local Authority,Greater London
