webpage,id,slug,title,state,sharing,createdAt,updatedAt,licence,licence_notes,publisher,featured_dataset,author,author_email,maintainer,maintainer_email,update_frequency,odi-certificate,tags,topic-business-and-economy,topic-championing-london,topic-crime-and-community-safety,topic-demographics,topic-education,topic-employment-and-skills,topic-environment,topic-health,topic-housing,topic-art-and-culture,topic-london-2012,topic-planning,topic-sport,topic-transparency,topic-transport,topic-young-people,topic-income-poverty-welfare,parent,london_smallest_geography,london_bounding_box
https://data.london.gov.uk/dataset/children-out-work-benefit-households-borough,282ecb40-b72d-4e72-871f-fc7a2973c28e,children-out-work-benefit-households-borough,"Children in Out-of-Work Benefit Households, Ward and Borough",active,public,03-Mar-14,30-Sep-16,UK Open Government Licence (OGL v2),,Department for Work and Pensions,,Department for Work and Pensions,,Opinion Research and General Statistics (GLA),datastore@london.gov.uk,Annually,https://certificates.theodi.org/datasets/23223/certificate,"benefits, poverty, work, employment, children, out, child, deprivation",FALSE,FALSE,FALSE,FALSE,FALSE,TRUE,FALSE,FALSE,FALSE,FALSE,FALSE,FALSE,FALSE,FALSE,FALSE,FALSE,FALSE,0b8c2363-5766-42fb-9191-1f1f6dd0c74d,Ward,Greater London
https://data.london.gov.uk/dataset/london-labour-market-indicators,843aa28f-8c50-463b-8234-689791460ce0,london-labour-market-indicators,"London Labour Market, Skills and Employment Indicators",active,public,15-Oct-14,29-Sep-16,UK Open Government Licence (OGL v2),,Greater London Authority (GLA),,Centre for Skills and Inclusion,,Opinion Research and General Statistics (GLA),datastore@london.gov.uk,Monthly,https://certificates.theodi.org/datasets/22748/certificate,"haringey, barnet, newham, brent, wandsworth, camden, barking-and-dagenham, hackney, waltham-forest, redbridge, lambeth, hounslow, lewisham, havering, kensington-and-chelsea, croydon, hammersmith-and-fulham, islington, harrow, merton, enfield, greenwich, city-of-london, sutton, bexley, ealing, hillingdon, bromley, southwark, richmond-upon-thames, kingston-upon-thames, tower-hamlets, westminster",TRUE,FALSE,FALSE,FALSE,TRUE,TRUE,FALSE,FALSE,FALSE,FALSE,FALSE,FALSE,FALSE,FALSE,FALSE,FALSE,FALSE,5b858cb2-5c92-4b2b-8c1d-141cfc330d9c,Local Authority,
https://data.london.gov.uk/dataset/clean-air-consultation-july-2016,b15e1439-17f9-4df6-9589-67d2d892c449,clean-air-consultation-july-2016,Clean Air Consultation – July 2016,active,public,12-Sep-16,23-Sep-16,Not Specified,,Greater London Authority (GLA),,,,Opinion Research and General Statistics (GLA),datastore@london.gov.uk,Ad hoc,,air-quality,FALSE,FALSE,FALSE,FALSE,FALSE,FALSE,TRUE,FALSE,FALSE,FALSE,FALSE,FALSE,FALSE,TRUE,FALSE,FALSE,FALSE,5b858cb2-5c92-4b2b-8c1d-141cfc330d9c,,
https://data.london.gov.uk/dataset/westminster-s-city-plan---strategic-policies--adopted-november-2013-,44d912d9-8c38-42d4-8b9c-353cb5c540b2,westminster-s-city-plan---strategic-policies--adopted-november-2013-,Westminster's City Plan - Strategic Policies (Adopted November 2013),active,public,21-Sep-16,21-Sep-16,UK Open Government Licence (OGL v3),,London Borough of Westminster,,Jo Lodge,jlodge@westminster.gov.uk,Westminster City Council,jlodge@westminster.gov.uk,Ad hoc,,,FALSE,FALSE,FALSE,FALSE,FALSE,FALSE,FALSE,FALSE,FALSE,FALSE,FALSE,TRUE,FALSE,FALSE,FALSE,FALSE,FALSE,99869898-823a-4550-a12b-1f4876a70444,,
https://data.london.gov.uk/dataset/jobs-by-occupation-and-highest-qualification,09e16e54-c1dd-4f83-b97f-a83208ae62e4,jobs-by-occupation-and-highest-qualification,Jobs by occupation and highest qualification,active,public,28-Mar-16,14-Sep-16,UK Open Government Licence (OGL v3),,Office for National Statistics (ONS),,,,,,Annually,,,FALSE,FALSE,FALSE,FALSE,FALSE,TRUE,FALSE,FALSE,FALSE,FALSE,FALSE,FALSE,FALSE,FALSE,FALSE,FALSE,FALSE,2b9d2485-1e5a-4b9b-922c-a2a4d42a864a,,
https://data.london.gov.uk/dataset/jobs-by-age-and-gender,363513cb-8f2d-498b-afc3-038aeee35fcb,jobs-by-age-and-gender,Jobs by age and gender,active,public,28-Mar-16,09-Sep-16,UK Open Government Licence (OGL v3),,Office for National Statistics (ONS),,,,,,Annually,,,FALSE,FALSE,FALSE,FALSE,FALSE,TRUE,FALSE,FALSE,FALSE,FALSE,FALSE,FALSE,FALSE,FALSE,FALSE,FALSE,FALSE,2b9d2485-1e5a-4b9b-922c-a2a4d42a864a,,
https://data.london.gov.uk/dataset/students-by-higher-education-provider-,5433d58a-ea5a-47f8-bba3-fef2331afadd,students-by-higher-education-provider-,Students by higher education provider,active,public,01-Mar-16,09-Sep-16,UK Open Government Licence (OGL v3),,Higher Education Statistics Agency,,,,,,Annually,,,FALSE,FALSE,FALSE,FALSE,TRUE,TRUE,FALSE,FALSE,FALSE,FALSE,FALSE,FALSE,FALSE,FALSE,FALSE,FALSE,FALSE,6192f493-1022-4b69-8b1d-ab3a5a179b71,,
https://data.london.gov.uk/dataset/self-employment-by-industry,0d8cfbbd-c562-457f-834b-6b7375996d30,self-employment-by-industry,Self employment by industry,active,public,10-Feb-16,07-Sep-16,UK Open Government Licence (OGL v3),,Office for National Statistics (ONS),,,,,,Ad hoc,,,FALSE,FALSE,FALSE,FALSE,FALSE,FALSE,FALSE,FALSE,FALSE,FALSE,FALSE,FALSE,FALSE,FALSE,FALSE,FALSE,FALSE,2b9d2485-1e5a-4b9b-922c-a2a4d42a864a,,
https://data.london.gov.uk/dataset/londoners-with-more-than-one-job,b4b88b33-ac68-49e7-af4b-611d3c92eb66,londoners-with-more-than-one-job,Londoners with more than one job,active,public,28-Mar-16,07-Sep-16,UK Open Government Licence (OGL v2),,Office for National Statistics (ONS),,,,,,Ad hoc,,,FALSE,FALSE,FALSE,FALSE,FALSE,FALSE,FALSE,FALSE,FALSE,FALSE,FALSE,FALSE,FALSE,FALSE,FALSE,FALSE,FALSE,2b9d2485-1e5a-4b9b-922c-a2a4d42a864a,,
https://data.london.gov.uk/dataset/graduates-working-in-non-graduate-roles,7b52edf1-4021-41a2-9d72-2d85543614d5,graduates-working-in-non-graduate-roles,Graduates working in non-graduate roles,active,public,29-May-16,07-Sep-16,UK Open Government Licence (OGL v2),,Office for National Statistics (ONS),,,,,,Ad hoc,,,FALSE,FALSE,FALSE,FALSE,FALSE,FALSE,FALSE,FALSE,FALSE,FALSE,FALSE,FALSE,FALSE,FALSE,FALSE,FALSE,FALSE,2b9d2485-1e5a-4b9b-922c-a2a4d42a864a,,
https://data.london.gov.uk/dataset/underemployed-and-overemployed-workers,9cd09421-fae7-414b-81a4-5b63a9122b69,underemployed-and-overemployed-workers,Underemployed and overemployed workers,active,public,07-Jun-16,07-Sep-16,UK Open Government Licence (OGL v2),,Office for National Statistics (ONS),,,,,,Ad hoc,,,FALSE,FALSE,FALSE,FALSE,FALSE,FALSE,FALSE,FALSE,FALSE,FALSE,FALSE,FALSE,FALSE,FALSE,FALSE,FALSE,FALSE,2b9d2485-1e5a-4b9b-922c-a2a4d42a864a,,
https://data.london.gov.uk/dataset/flows-into-and-out-of-employment,e622a854-244a-468b-bcb6-f3683106936f,flows-into-and-out-of-employment,Flows into and out of employment,active,public,06-Jun-16,07-Sep-16,UK Open Government Licence (OGL v2),,Office for National Statistics (ONS),,,,,,Ad hoc,,,FALSE,FALSE,FALSE,FALSE,FALSE,FALSE,FALSE,FALSE,FALSE,FALSE,FALSE,FALSE,FALSE,FALSE,FALSE,FALSE,FALSE,2b9d2485-1e5a-4b9b-922c-a2a4d42a864a,,
https://data.london.gov.uk/dataset/workforce-jobs-by-sectors,506cd974-45de-4a58-9cc3-ea3251a5ccb1,workforce-jobs-by-sectors,Workforce Jobs by sector,active,public,30-May-16,06-Sep-16,UK Open Government Licence (OGL v3),,Office for National Statistics (ONS),,,,,,Quarterly,,,FALSE,FALSE,FALSE,FALSE,FALSE,FALSE,FALSE,FALSE,FALSE,FALSE,FALSE,FALSE,FALSE,FALSE,FALSE,FALSE,FALSE,2b9d2485-1e5a-4b9b-922c-a2a4d42a864a,,
https://data.london.gov.uk/dataset/llaqm-bespoke-borough-by-borough-air-quality-modelling-and-data,02de7221-08b1-4ebd-84e3-ba9611347eb4,llaqm-bespoke-borough-by-borough-air-quality-modelling-and-data,LLAQM bespoke borough by borough 2013 air quality modelling and data,active,public,01-Jul-15,03-Aug-16,Not Specified,,GLA and TFL Air Quality,,Popply Lyle (GLA),poppy.lyle@london.gov.uk,,,,,"emissions, PM10d, PM25, NOx, PM10, NO2",FALSE,FALSE,FALSE,FALSE,FALSE,FALSE,TRUE,FALSE,FALSE,FALSE,FALSE,FALSE,FALSE,FALSE,FALSE,FALSE,FALSE,393f3769-967c-4ee8-b0ff-ddd4c16ff7eb,Borough,
https://data.london.gov.uk/dataset/old-oak-and-park-royal-development-corporation-boundary-,e3ebcb87-b364-4612-84ab-8ddfc1d3753b,old-oak-and-park-royal-development-corporation-boundary-,Old Oak and Park Royal Development Corporation Boundary,active,public,28-Jul-16,28-Jul-16,UK Open Government Licence (OGL v3),,Greater London Authority (GLA),,Greater London Authority,datastore@london.gov.uk,Greater London Authority,datastore@london.gov.uk,Ad hoc,,GIS,FALSE,FALSE,FALSE,FALSE,FALSE,FALSE,FALSE,FALSE,FALSE,FALSE,FALSE,TRUE,FALSE,FALSE,FALSE,FALSE,FALSE,5b858cb2-5c92-4b2b-8c1d-141cfc330d9c,Custom Polygons,
https://data.london.gov.uk/dataset/kingston-dot,091205d2-5f9a-46c1-b3a9-6eb2cba6a81c,kingston-dot,Kingston DoT,active,public,28-Jun-16,27-Jul-16,Open Data Commons Public Domain Dedication and License (PDDL),,Greater London Authority (GLA),,,,,,,,,FALSE,FALSE,FALSE,FALSE,FALSE,FALSE,FALSE,FALSE,FALSE,FALSE,FALSE,TRUE,FALSE,FALSE,FALSE,FALSE,FALSE,5b858cb2-5c92-4b2b-8c1d-141cfc330d9c,,
https://data.london.gov.uk/dataset/estimating-births-using-gp-registration-data,1b191c37-0eb1-4d76-a69b-cf95449cbde4,estimating-births-using-gp-registration-data,Estimating births using GP registration data,active,public,21-Jan-16,26-Jul-16,UK Open Government Licence (OGL v3),,Greater London Authority (GLA),,GLA Intelligence Unit,intelligence@london.gov.uk,Demography,demography@london.gov.uk,Ad hoc,,"estimates, births, nhs, technical, ONS, population projections",FALSE,FALSE,FALSE,TRUE,FALSE,FALSE,FALSE,FALSE,FALSE,FALSE,FALSE,FALSE,FALSE,FALSE,FALSE,FALSE,FALSE,5b858cb2-5c92-4b2b-8c1d-141cfc330d9c,Ward,
https://data.london.gov.uk/dataset/london-office-of-data-analytics,daf98dcc-af36-405f-b565-f9dc7170fa8f,london-office-of-data-analytics,London Office of Data Analytics,active,public,07-Jul-16,08-Jul-16,UK Open Government Licence (OGL v2),,Greater London Authority (GLA),,NESTA,eddie.copeland@nesta.org.uk,City Data Team,datastore@london.gov.uk,Ad hoc,,"LODA, Data Science",FALSE,FALSE,FALSE,FALSE,FALSE,FALSE,FALSE,FALSE,FALSE,FALSE,FALSE,FALSE,FALSE,FALSE,FALSE,FALSE,FALSE,5b858cb2-5c92-4b2b-8c1d-141cfc330d9c,N/A,
https://data.london.gov.uk/dataset/eu-referendum-results,9c93572b-4c62-4666-9f62-607365144943,eu-referendum-results,EU Referendum Results,active,public,23-Jun-16,22-Jun-16,UK Open Government Licence (OGL v3),,Greater London Authority (GLA),,Electoral Commission,press@electoralcommission.org.uk,Greater London Authority,datastore@london.gov.uk,One off,,"borough, EU, European, Union, referendum, elections, brexit",FALSE,FALSE,FALSE,FALSE,FALSE,FALSE,FALSE,FALSE,FALSE,FALSE,FALSE,FALSE,FALSE,TRUE,FALSE,FALSE,FALSE,5b858cb2-5c92-4b2b-8c1d-141cfc330d9c,Borough,
https://data.london.gov.uk/dataset/london-assembly-constituency-profiles-2016,3c035a0f-f723-4e3e-a208-f038bcbd8b6b,london-assembly-constituency-profiles-2016,London Assembly Constituency Profiles 2016,active,public,31-May-16,20-Jun-16,UK Open Government Licence (OGL v3),,Greater London Authority (GLA),,Greater London Authority,datastore@london.gov.uk,Greater London Authority,datastore@london.gov.uk,Ad hoc,,,TRUE,FALSE,TRUE,TRUE,FALSE,TRUE,FALSE,TRUE,TRUE,FALSE,FALSE,FALSE,FALSE,FALSE,FALSE,FALSE,FALSE,5b858cb2-5c92-4b2b-8c1d-141cfc330d9c,GLA Constituency,
https://data.london.gov.uk/dataset/hospital-admission-rates,8057d236-12f9-4f76-a133-4b4516af1f6d,hospital-admission-rates,Hospital Admission Rates,active,public,27-Jun-14,16-Jun-16,UK Open Government Licence (OGL v2),,Information Centre for Health and Social Care,,London Health Observatory,,Opinion Research and General Statistics (GLA),datastore@london.gov.uk,Annually,https://certificates.theodi.org/datasets/23156/certificate,"health, hospital, admissions",FALSE,FALSE,FALSE,FALSE,FALSE,FALSE,FALSE,TRUE,FALSE,FALSE,FALSE,FALSE,FALSE,FALSE,FALSE,FALSE,FALSE,30fbedec-abd8-43a7-a174-cd32a36d76d6,Local Authority,Greater London
https://data.london.gov.uk/dataset/london-elections-results-2016-wards-boroughs-constituency,26865254-6aeb-4f7a-a29b-8c0ca064824b,london-elections-results-2016-wards-boroughs-constituency,"London Elections Results 2016, Wards, Boroughs, Constituency",active,public,27-May-16,31-May-16,UK Open Government Licence (OGL v3),,Greater London Authority (GLA),,Greater London Authority,,Opinion Research and General Statistics (GLA),datastore@london.gov.uk,Ad hoc,,"elections, assembly, poll, mayoral, mayor, vote, map, votes",FALSE,FALSE,FALSE,FALSE,FALSE,FALSE,FALSE,FALSE,FALSE,FALSE,FALSE,FALSE,FALSE,TRUE,FALSE,FALSE,FALSE,5b858cb2-5c92-4b2b-8c1d-141cfc330d9c,Ward,
https://data.london.gov.uk/dataset/skills-londons-economy,046835f2-2b23-40cb-a537-5698433c5535,skills-londons-economy,Skills for London's economy,active,public,25-May-16,25-May-16,UK Open Government Licence (OGL v2),,Greater London Authority (GLA),,Joel Marsden,joel.marsden@london.gov.uk,GLA Economics,GLAEconomics@london.gov.uk,Ad hoc,,"further-education, jobs, skills, employment, Sectors, Qualifications, occupation",TRUE,TRUE,FALSE,FALSE,TRUE,TRUE,FALSE,FALSE,FALSE,FALSE,FALSE,FALSE,FALSE,FALSE,FALSE,TRUE,FALSE,5b858cb2-5c92-4b2b-8c1d-141cfc330d9c,Sub-Region,
https://data.london.gov.uk/dataset/indices-of-deprivation-2015,379d4406-4012-4019-862a-5388cdf37a8c,indices-of-deprivation-2015,Indices of Deprivation 2015,active,public,30-Sep-15,24-May-16,Not Specified,,"Ministry of Housing, Communities & Local Government (MHCLG)",,Rachel Leeser,sedata@london.gov.uk,Rachel Leeser,sedata@london.gov.uk,Ad hoc,,"poverty, deprivation, lsoa",FALSE,FALSE,FALSE,TRUE,FALSE,FALSE,FALSE,FALSE,FALSE,FALSE,FALSE,FALSE,FALSE,FALSE,FALSE,FALSE,TRUE,8070677a-2a67-4103-9cf6-d7764d1a9593,Lower Super Output Area,
https://data.london.gov.uk/dataset/data-for-london-a-city-data-strategy,b01e454c-c7a2-4c29-85ff-d7c9823b4c40,data-for-london-a-city-data-strategy,Data for London - A City Data Strategy,active,public,01-Mar-16,19-May-16,UK Open Government Licence (OGL v3),,Greater London Authority (GLA),,City Data Team,datastore@london.gov.uk,City Data Team,datastore@london.gov.uk,Ad hoc,,,TRUE,TRUE,FALSE,FALSE,FALSE,FALSE,FALSE,FALSE,FALSE,FALSE,FALSE,FALSE,FALSE,TRUE,FALSE,FALSE,FALSE,5b858cb2-5c92-4b2b-8c1d-141cfc330d9c,Greater London,
https://data.london.gov.uk/dataset/monthly-mix-adjusted-average-house-prices-london,f08d9dbc-0abc-47fd-b28a-7d35d1403ed8,monthly-mix-adjusted-average-house-prices-london,"Monthly Mix-Adjusted Average House Prices, London",active,public,22-Sep-14,18-May-16,UK Open Government Licence (OGL v2),,Office for National Statistics (ONS),,Office for National Statistics,,Opinion Research and General Statistics (GLA),datastore@london.gov.uk,Monthly,https://certificates.theodi.org/datasets/22746/certificate,"house-prices-index, time, series",FALSE,FALSE,FALSE,FALSE,FALSE,FALSE,FALSE,FALSE,TRUE,FALSE,FALSE,FALSE,FALSE,FALSE,FALSE,FALSE,FALSE,2b9d2485-1e5a-4b9b-922c-a2a4d42a864a,Region,
https://data.london.gov.uk/dataset/better-use-of-data---gla-consultation-response,e5008143-5bb8-4dec-b7f8-cb4ba5853f1c,better-use-of-data---gla-consultation-response,Better Use of Data - GLA Consultation Response,active,public,05-May-16,05-May-16,Not Specified,,Greater London Authority (GLA),,Greater London Authority,,Greater London Authority,,,,,FALSE,FALSE,FALSE,FALSE,FALSE,FALSE,FALSE,FALSE,FALSE,FALSE,FALSE,FALSE,FALSE,TRUE,FALSE,FALSE,FALSE,5b858cb2-5c92-4b2b-8c1d-141cfc330d9c,,
https://data.london.gov.uk/dataset/lvmf-protected-vistas-gis-files,7c5ef1aa-a6bc-459e-a8e9-a33ff8e2989a,lvmf-protected-vistas-gis-files,LVMF protected vistas - GIS files,active,public,13-Feb-14,15-Apr-16,UK Open Government Licence (OGL v2),,Greater London Authority (GLA),,Greater London Authority,,GIS and Infrastructure team (GLA),,Ad hoc,https://certificates.theodi.org/datasets/23238/certificate,"views, protected-vistas, viewing-corridors, lvmf",FALSE,FALSE,FALSE,FALSE,FALSE,FALSE,FALSE,FALSE,FALSE,FALSE,FALSE,TRUE,FALSE,FALSE,FALSE,FALSE,FALSE,5b858cb2-5c92-4b2b-8c1d-141cfc330d9c,Custom Polygons,Greater London
https://data.london.gov.uk/dataset/assembly-member-register-interests,0dd3b5d3-bae5-42a2-b7cc-163c9bc84c8e,assembly-member-register-interests,Assembly Member Register of Interests,active,public,04-Sep-13,14-Apr-16,UK Open Government Licence (OGL v2),,Greater London Authority (GLA),,Greater London Authority,,Finance Department (GLA),,Ad hoc,https://certificates.theodi.org/datasets/23314/certificate,"assembly-members, interests",FALSE,FALSE,FALSE,FALSE,FALSE,FALSE,FALSE,FALSE,FALSE,FALSE,FALSE,FALSE,FALSE,TRUE,FALSE,FALSE,FALSE,5b858cb2-5c92-4b2b-8c1d-141cfc330d9c,,
https://data.london.gov.uk/dataset/internet-and-computer-use-london,bba45ed1-82b2-4c77-a863-36c3a6c4bfd4,internet-and-computer-use-london,"Internet and Computer use, London",active,public,20-Nov-13,14-Apr-16,UK Open Government Licence (OGL v2),,Office for National Statistics (ONS),,Office for National Statistics,,Opinion Research and General Statistics (GLA),datastore@london.gov.uk,Annually,https://certificates.theodi.org/datasets/23270/certificate,"access, technology, email, information, computer, tablet, mobile, smartphones, laptop, social-networking, portable, broadband, internet",FALSE,FALSE,FALSE,FALSE,FALSE,FALSE,FALSE,FALSE,FALSE,TRUE,FALSE,FALSE,FALSE,FALSE,FALSE,FALSE,FALSE,2b9d2485-1e5a-4b9b-922c-a2a4d42a864a,Greater London,Greater London
https://data.london.gov.uk/dataset/bishopsgate-goodsyard-technical-reports,499a88a2-2527-4808-9f5f-09500af5523b,bishopsgate-goodsyard-technical-reports,Bishopsgate Goodsyard Technical Reports,active,public,05-Apr-16,05-Apr-16,Open Data Commons Public Domain Dedication and License (PDDL),,Greater London Authority (GLA),,GLA Planning,,GLA Planning,planningadmin@london.gov.uk,Ad hoc,,,FALSE,FALSE,FALSE,FALSE,FALSE,FALSE,FALSE,FALSE,FALSE,FALSE,FALSE,TRUE,FALSE,FALSE,FALSE,FALSE,FALSE,5b858cb2-5c92-4b2b-8c1d-141cfc330d9c,,
https://data.london.gov.uk/dataset/gla-grant-funding,ef5e9a15-3237-4545-b67c-25714499889c,gla-grant-funding,GLA Grant Funding,active,public,18-Sep-12,22-Mar-16,UK Open Government Licence (OGL v2),,Greater London Authority (GLA),,Greater London Authority,,Finance Department (GLA),,Ad hoc,https://certificates.theodi.org/datasets/23315/certificate,"funding, grants, voluntary, community, social-enterprise",FALSE,FALSE,FALSE,FALSE,FALSE,FALSE,FALSE,FALSE,FALSE,FALSE,FALSE,FALSE,FALSE,TRUE,FALSE,FALSE,FALSE,5b858cb2-5c92-4b2b-8c1d-141cfc330d9c,,
https://data.london.gov.uk/dataset/ask-boris-social-media-monitoring,7ae4190c-e500-4c90-a7d8-26f607e3ac3b,ask-boris-social-media-monitoring,Ask Boris social media monitoring,active,public,11-Sep-14,21-Mar-16,UK Open Government Licence (OGL v2),,Greater London Authority (GLA),,Greater London Authority,,Tweetreach,,Monthly,https://certificates.theodi.org/datasets/22760/certificate,"public-engagement, tweetreach, consultation, twitter, social-media",FALSE,FALSE,FALSE,FALSE,FALSE,FALSE,FALSE,FALSE,FALSE,FALSE,FALSE,FALSE,FALSE,TRUE,FALSE,FALSE,FALSE,5b858cb2-5c92-4b2b-8c1d-141cfc330d9c,Worldwide,Worldwide
https://data.london.gov.uk/dataset/london-atmospheric-emissions-inventory-2010,09b417af-68b2-4a3c-87aa-d1b9ece21a2f,london-atmospheric-emissions-inventory-2010,London Atmospheric Emissions Inventory (LAEI) 2010,active,public,09-Jul-13,18-Mar-16,UK Open Government Licence (OGL v2),<http://data.london.gov.uk/datastore/terms-and-conditions>,Greater London Authority (GLA),,Air Quality Team (GLA),,Air Quality Team (GLA),,Ad hoc,https://certificates.theodi.org/datasets/23292/certificate,"nitrogen-dioxide, laei, particulate-matter, air-pollution",FALSE,FALSE,FALSE,FALSE,FALSE,FALSE,TRUE,FALSE,FALSE,FALSE,FALSE,FALSE,FALSE,FALSE,FALSE,FALSE,FALSE,5b858cb2-5c92-4b2b-8c1d-141cfc330d9c,1km Grid Squares,Greater London and M25
https://data.london.gov.uk/dataset/air-quality-summary-statistics,221a539e-14ab-4044-a42d-79fb5b7268c1,air-quality-summary-statistics,Air quality summary statistics,active,public,11-Mar-16,16-Mar-16,UK Open Government Licence (OGL v2),,Greater London Authority (GLA),,King's College London,ergenquiries@kcl.ac.uk,Opinion Research and General Statistics (GLA),datastore@london.gov.uk,Ad hoc,,,FALSE,FALSE,FALSE,FALSE,FALSE,FALSE,TRUE,FALSE,FALSE,FALSE,FALSE,FALSE,FALSE,FALSE,FALSE,FALSE,FALSE,5b858cb2-5c92-4b2b-8c1d-141cfc330d9c,Greater London,
https://data.london.gov.uk/dataset/gla-survey-results--private-hire-vehicle-regulations,0040e6a1-9a2a-4772-8497-edbabd6d0957,gla-survey-results--private-hire-vehicle-regulations,GLA Survey Results: Private Hire Vehicle Regulations,active,public,10-Mar-16,10-Mar-16,UK Open Government Licence (OGL v3),,Greater London Authority (GLA),,Opinion Research and General Statistics (GLA),datastore@london.gov.uk,Opinion Research and General Statistics (GLA),datastore@london.gov.uk,Ad hoc,,,FALSE,FALSE,FALSE,FALSE,FALSE,FALSE,FALSE,FALSE,FALSE,FALSE,FALSE,FALSE,FALSE,FALSE,TRUE,FALSE,FALSE,5b858cb2-5c92-4b2b-8c1d-141cfc330d9c,,
https://data.london.gov.uk/dataset/create-your-own-mapping-templates---excel-add-in,0d97b133-0e1d-4363-916a-68e70220d940,create-your-own-mapping-templates---excel-add-in,Create your own mapping templates - Excel Add-In,active,public,26-Feb-16,07-Mar-16,UK Open Government Licence (OGL v2),,Tim Lund,,Tim Lund,,Tim Lund,,Ad hoc,,"mapping, excel",FALSE,TRUE,FALSE,FALSE,FALSE,FALSE,FALSE,FALSE,FALSE,FALSE,FALSE,FALSE,FALSE,FALSE,FALSE,FALSE,FALSE,f6699239-ac3f-42d7-a5f3-1a55bcd9a060,,
https://data.london.gov.uk/dataset/camden-data,97824c41-830b-4ff8-923f-a5c10c40a1c0,camden-data,Camden Data,active,public,26-Jul-11,25-Feb-16,UK Open Government Licence (OGL v2),,London Borough of Camden,,London Borough of Camden,,London Borough of Camden,,Ad hoc,https://certificates.theodi.org/datasets/22941/certificate,geo,TRUE,FALSE,TRUE,TRUE,TRUE,TRUE,TRUE,TRUE,TRUE,FALSE,FALSE,FALSE,TRUE,TRUE,TRUE,TRUE,FALSE,b444fede-9ede-46e7-94f9-e42f2918b827,,London Borough of Camden
https://data.london.gov.uk/dataset/census-2011-small-population-tables,ba2ad306-efe5-4054-a78f-7872fa1a9659,census-2011-small-population-tables,Country of Birth (Census 2011 Small Population Tables),active,public,18-Feb-16,25-Feb-16,UK Open Government Licence (OGL v3),,Census Information Scheme,,Census Information Scheme,census@london.gov.uk,Census Information Scheme,census@london.gov.uk,Ad hoc,,,FALSE,FALSE,FALSE,TRUE,FALSE,TRUE,FALSE,TRUE,TRUE,FALSE,FALSE,FALSE,FALSE,FALSE,FALSE,FALSE,FALSE,be83dfcf-79d3-4a6e-aa28-df33dc6bc3d8,Borough,
https://data.london.gov.uk/dataset/country-of-birth---population-pyramid-tool,43caab79-c14a-4145-af36-66b4aee2e995,country-of-birth---population-pyramid-tool,Country of Birth - Population Pyramid Tool,active,public,25-Feb-16,25-Feb-16,UK Open Government Licence (OGL v3),,Census Information Scheme,,Census Information Scheme,census@london.gov.uk,Census Information Scheme,census@london.gov.uk,Ad hoc,,"census, age, pyramid, sex, nationality, country, population, birth, 2011",FALSE,FALSE,FALSE,TRUE,FALSE,FALSE,FALSE,FALSE,FALSE,FALSE,FALSE,FALSE,FALSE,FALSE,FALSE,FALSE,FALSE,be83dfcf-79d3-4a6e-aa28-df33dc6bc3d8,Borough,
https://data.london.gov.uk/dataset/annual-london-survey-2015,8a80423d-6705-461f-8681-f25aa3fa6c0b,annual-london-survey-2015,Annual London Survey 2015,active,public,14-Jan-16,18-Feb-16,UK Open Government Licence (OGL v3),,Greater London Authority (GLA),,,,Opinion Research and General Statistics (GLA),datastore@london.gov.uk,Ad hoc,,"priorities, satisfaction, als2015, survey, residents, opinion",FALSE,TRUE,FALSE,FALSE,FALSE,FALSE,FALSE,FALSE,FALSE,FALSE,FALSE,FALSE,FALSE,TRUE,FALSE,FALSE,FALSE,5b858cb2-5c92-4b2b-8c1d-141cfc330d9c,,
https://data.london.gov.uk/dataset/mortgage-and-landlord-possession-actions-borough,36ae720b-0409-46bc-a49b-4300f26c51d1,mortgage-and-landlord-possession-actions-borough,"Mortgage and Landlord Possession Actions, Borough",active,public,05-Sep-14,11-Feb-16,UK Open Government Licence (OGL v2),,Ministry of Justice,,Ministry of Justice,,Opinion Research and General Statistics (GLA),datastore@london.gov.uk,Quarterly,https://certificates.theodi.org/datasets/22742/certificate,"repossessions, landlord, mortgage, housing, debt",FALSE,FALSE,FALSE,FALSE,FALSE,FALSE,FALSE,FALSE,TRUE,FALSE,FALSE,FALSE,FALSE,FALSE,FALSE,FALSE,FALSE,20ed4651-0139-41d7-b526-0de25bc064c9,Local Authority,Greater London
https://data.london.gov.uk/dataset/suicide-mortality-rates-borough,00c595b2-673f-4074-b0e9-25f32dfbf16a,suicide-mortality-rates-borough,"Suicide Mortality Rates, Borough",active,public,02-Jan-14,11-Feb-16,UK Open Government Licence (OGL v2),,Department of Health,,Department of Health,,Opinion Research and General Statistics (GLA),datastore@london.gov.uk,Annually,https://certificates.theodi.org/datasets/23201/certificate,"injury-undetermined, gender, suicide, death, mortality, depression, mental-health",FALSE,FALSE,FALSE,FALSE,FALSE,FALSE,FALSE,TRUE,FALSE,FALSE,FALSE,FALSE,FALSE,FALSE,FALSE,FALSE,FALSE,248b2a9f-74b6-4667-a173-4e92c1203a68,Local Authority,Greater London
https://data.london.gov.uk/dataset/birth-and-death-rates-ward,4a84f0df-0a22-4d35-af78-0fa43cd5b824,birth-and-death-rates-ward,"Birth and Death Rates, Ward",active,public,01-Apr-14,09-Feb-16,UK Open Government Licence (OGL v2),,Office for National Statistics (ONS),,Office for National Statistics,,Opinion Research and General Statistics (GLA),datastore@london.gov.uk,Annually,https://certificates.theodi.org/datasets/22818/certificate,"births, rates, smr, wards, deaths, gfr",FALSE,FALSE,FALSE,TRUE,FALSE,FALSE,FALSE,FALSE,FALSE,FALSE,FALSE,FALSE,FALSE,FALSE,FALSE,FALSE,FALSE,2b9d2485-1e5a-4b9b-922c-a2a4d42a864a,Ward,Greater London
