webpage,id,slug,title,state,sharing,createdAt,updatedAt,licence,licence_notes,publisher,featured_dataset,author,author_email,maintainer,maintainer_email,update_frequency,odi-certificate,tags,topic-business-and-economy,topic-championing-london,topic-crime-and-community-safety,topic-demographics,topic-education,topic-employment-and-skills,topic-environment,topic-health,topic-housing,topic-art-and-culture,topic-london-2012,topic-planning,topic-sport,topic-transparency,topic-transport,topic-young-people,topic-income-poverty-welfare,parent,london_smallest_geography,london_bounding_box
https://data.london.gov.uk/dataset/alternative-olympics-2012-medal-table,c57ce042-3fed-43fc-858f-1746a99e2606,alternative-olympics-2012-medal-table,Alternative Olympics 2012 Medal Table,active,public,06-Aug-12,07-Jul-14,UK Open Government Licence (OGL v2),,Greater London Authority (GLA),,Greater London Authority,,Opinion Research and General Statistics (GLA),datastore@london.gov.uk,Ad hoc,https://certificates.theodi.org/datasets/22970/certificate,"london, medals",FALSE,FALSE,FALSE,FALSE,FALSE,FALSE,FALSE,FALSE,FALSE,TRUE,TRUE,FALSE,TRUE,FALSE,FALSE,FALSE,FALSE,5b858cb2-5c92-4b2b-8c1d-141cfc330d9c,Country,
https://data.london.gov.uk/dataset/overcrowded-households-borough,926667d0-e899-43a7-8d79-a925d89b60ba,overcrowded-households-borough,Overcrowded Households by Borough,active,public,14-Mar-12,07-Jul-14,UK Open Government Licence (OGL v2),,Office for National Statistics (ONS),,Office for National Statistics,,Opinion Research and General Statistics (GLA),datastore@london.gov.uk,Annually,https://certificates.theodi.org/datasets/22972/certificate,"overcrowding, overcrowded",FALSE,FALSE,FALSE,FALSE,FALSE,FALSE,FALSE,FALSE,TRUE,FALSE,FALSE,FALSE,FALSE,FALSE,FALSE,FALSE,FALSE,2b9d2485-1e5a-4b9b-922c-a2a4d42a864a,Local Authority,Greater London
https://data.london.gov.uk/dataset/london-fuel-poverty-risk-indicators-wards,3332c8e9-60da-4ec6-8364-fee1eb2ecef6,london-fuel-poverty-risk-indicators-wards,"London Fuel Poverty Risk Indicators, Wards",active,public,12-Mar-12,07-Jul-14,UK Open Government Licence (OGL v2),,Greater London Authority (GLA),,Greater London Authority,,Opinion Research and General Statistics (GLA),datastore@london.gov.uk,Ad hoc,https://certificates.theodi.org/datasets/22976/certificate,"wards, fuel-poverty, poverty, housing",FALSE,FALSE,FALSE,TRUE,FALSE,FALSE,FALSE,TRUE,TRUE,FALSE,FALSE,FALSE,FALSE,FALSE,FALSE,FALSE,FALSE,5b858cb2-5c92-4b2b-8c1d-141cfc330d9c,Ward,Greater London
https://data.london.gov.uk/dataset/mayoral-development-corporation-boundary,37978ed1-9528-4a3c-a01f-e3156e97d215,mayoral-development-corporation-boundary,Mayoral Development Corporation Boundary,active,public,05-Mar-12,07-Jul-14,UK Open Government Licence (OGL v2),,Greater London Authority (GLA),,Greater London Authority,,Opinion Research and General Statistics (GLA),datastore@london.gov.uk,Ad hoc,https://certificates.theodi.org/datasets/22978/certificate,"development, geo, planning, regeneration",FALSE,FALSE,FALSE,FALSE,FALSE,FALSE,FALSE,FALSE,FALSE,FALSE,FALSE,TRUE,FALSE,FALSE,FALSE,FALSE,FALSE,5b858cb2-5c92-4b2b-8c1d-141cfc330d9c,Custom Polygons,Mayoral Development Corporation
https://data.london.gov.uk/dataset/first-release,9b35a71e-d309-40f2-8d1b-411be05d2de1,first-release,2011 Census First Release Data,active,public,16-Jul-12,04-Jul-14,UK Open Government Licence (OGL v2),,Office for National Statistics (ONS),,Office for National Statistics,,Census Team (GLA),census@london.gov.uk,Ad hoc,https://certificates.theodi.org/datasets/22984/certificate,"2011-census, demography, census, population, households",FALSE,FALSE,FALSE,TRUE,FALSE,FALSE,FALSE,FALSE,FALSE,FALSE,FALSE,FALSE,FALSE,FALSE,FALSE,FALSE,FALSE,2b9d2485-1e5a-4b9b-922c-a2a4d42a864a,Local Authority,England and Wales
https://data.london.gov.uk/dataset/improvements-estimating-migration,d3c48940-1114-40bc-ae1f-0b5bb7682c38,improvements-estimating-migration,Improvements in Estimating Migration,active,public,22-Jun-12,04-Jul-14,UK Open Government Licence (OGL v2),,Greater London Authority (GLA),,Greater London Authority,,Opinion Research and General Statistics (GLA),datastore@london.gov.uk,Ad hoc,https://certificates.theodi.org/datasets/22982/certificate,"population, migration",FALSE,FALSE,FALSE,TRUE,FALSE,FALSE,FALSE,FALSE,FALSE,FALSE,FALSE,FALSE,FALSE,FALSE,FALSE,FALSE,FALSE,5b858cb2-5c92-4b2b-8c1d-141cfc330d9c,Local Authority,Greater London
https://data.london.gov.uk/dataset/unemployment-london-2012,dd7fb95c-a26e-49be-80da-6c9d5eb8c75f,unemployment-london-2012,Unemployment in London 2012,active,public,14-Mar-12,04-Jul-14,UK Open Government Licence (OGL v2),,Greater London Authority (GLA),,Greater London Authority,,Social Exclusion Team,sedata@london.gov.uk,Ad hoc,https://certificates.theodi.org/datasets/22985/certificate,"worklessness, labour-market, unemployment",FALSE,FALSE,FALSE,FALSE,FALSE,TRUE,FALSE,FALSE,FALSE,FALSE,FALSE,FALSE,FALSE,FALSE,FALSE,FALSE,FALSE,5b858cb2-5c92-4b2b-8c1d-141cfc330d9c,Greater London,UK
https://data.london.gov.uk/dataset/londons-jobs-history,19c4b256-d2f5-43df-b2a8-5dac02502300,londons-jobs-history,London's Jobs History,active,public,23-Jan-13,04-Jul-14,UK Open Government Licence (OGL v2),,Office for National Statistics (ONS),,Office for National Statistics,,GLA Economics,GLAEconomics@london.gov.uk,Annually,https://certificates.theodi.org/datasets/22989/certificate,jobs,TRUE,FALSE,FALSE,FALSE,FALSE,TRUE,FALSE,FALSE,FALSE,FALSE,FALSE,FALSE,FALSE,FALSE,FALSE,FALSE,FALSE,2b9d2485-1e5a-4b9b-922c-a2a4d42a864a,Local Authority,Greater London
https://data.london.gov.uk/dataset/decentralised-energy-capacity-study,b3b653aa-3260-489b-a0a2-e0b25fcd0f98,decentralised-energy-capacity-study,Decentralised Energy Capacity Study,active,public,21-Dec-11,04-Jul-14,UK Open Government Licence (OGL v2),,Greater London Authority (GLA),,Greater London Authority,,Environment Team (GLA),michael.doust@london.gov.uk,Ad hoc,https://certificates.theodi.org/datasets/22991/certificate,"low-carbon, energy-supply, decentralised-energy, renewable-energy",FALSE,FALSE,FALSE,FALSE,FALSE,FALSE,TRUE,FALSE,FALSE,FALSE,FALSE,FALSE,FALSE,FALSE,FALSE,FALSE,FALSE,5b858cb2-5c92-4b2b-8c1d-141cfc330d9c,Region,Greater London
https://data.london.gov.uk/dataset/climate-change-mitigation-and-energy-strategy-model-data,b7b60c49-4e08-4bad-8c69-ca4bf7bc7b29,climate-change-mitigation-and-energy-strategy-model-data,Climate Change Mitigation and Energy Strategy Model Data,active,public,22-May-12,04-Jul-14,UK Open Government Licence (OGL v2),,Greater London Authority (GLA),,Greater London Authority,,Environment Team (GLA),,Ad hoc,https://certificates.theodi.org/datasets/22993/certificate,"carbon-dioxide, emissions, carbon-reduction, mitigation, greenhouse-gas, climate-change, energy, model",FALSE,FALSE,FALSE,FALSE,FALSE,FALSE,TRUE,FALSE,FALSE,FALSE,FALSE,FALSE,FALSE,FALSE,FALSE,FALSE,FALSE,5b858cb2-5c92-4b2b-8c1d-141cfc330d9c,Region,Greater London
https://data.london.gov.uk/dataset/travel-patterns-and-trends-london,bcb8f659-b96d-4108-ae26-34121dcbb488,travel-patterns-and-trends-london,"Travel Patterns and Trends, London",active,public,29-Oct-11,04-Jul-14,UK Open Government Licence (OGL v2),,Greater London Authority (GLA),,Greater London Authority,,Opinion Research and General Statistics (GLA),datastore@london.gov.uk,Ad hoc,https://certificates.theodi.org/datasets/22992/certificate,"commuting, travel, transport",FALSE,FALSE,FALSE,FALSE,FALSE,FALSE,FALSE,FALSE,FALSE,FALSE,FALSE,FALSE,FALSE,FALSE,TRUE,FALSE,FALSE,5b858cb2-5c92-4b2b-8c1d-141cfc330d9c,Local Authority,Greater London
https://data.london.gov.uk/dataset/labour-market-flows,ecc81f8e-773d-49ac-9346-649d8e56b494,labour-market-flows,London Labour Market Flows,active,public,14-Sep-11,04-Jul-14,UK Open Government Licence (OGL v2),,Office for National Statistics (ONS),,Office for National Statistics,,Opinion Research and General Statistics (GLA),datastore@london.gov.uk,Ad hoc,https://certificates.theodi.org/datasets/22994/certificate,"labour-market, flows, longitudinal",FALSE,FALSE,FALSE,FALSE,FALSE,TRUE,FALSE,FALSE,FALSE,FALSE,FALSE,FALSE,FALSE,FALSE,FALSE,FALSE,FALSE,2b9d2485-1e5a-4b9b-922c-a2a4d42a864a,Greater London,
https://data.london.gov.uk/dataset/tube-network-upgrade-data-transport-committee-report,c15265de-9737-4ef9-9bb4-e09c75ef0a72,tube-network-upgrade-data-transport-committee-report,Tube Network Upgrade Data from Transport Committee Report,active,public,12-Sep-11,04-Jul-14,UK Open Government Licence (OGL v2),,Transport for London (TfL),,Transport for London,,London Assembly Scrutiny Team,,Ad hoc,https://certificates.theodi.org/datasets/22996/certificate,"ppp, transport, upgrades, underground, tube",FALSE,FALSE,FALSE,FALSE,FALSE,FALSE,FALSE,FALSE,FALSE,FALSE,FALSE,FALSE,FALSE,FALSE,TRUE,FALSE,FALSE,9a1c2a36-e5b8-459e-840a-7835f925e06c,Greater London,Greater London
https://data.london.gov.uk/dataset/tube-network-performance-data-transport-committee-report,0fa000c8-aab9-4852-9ea7-5a75a915f631,tube-network-performance-data-transport-committee-report,Tube Network Performance Data from Transport Committee Report,active,public,12-Sep-11,04-Jul-14,UK Open Government Licence (OGL v2),,Transport for London (TfL),,Transport for London,,London Assembly Scrutiny Team,,Ad hoc,https://certificates.theodi.org/datasets/22995/certificate,"perfomance, tube, transport, underground",FALSE,FALSE,FALSE,FALSE,FALSE,FALSE,FALSE,FALSE,FALSE,FALSE,FALSE,FALSE,FALSE,FALSE,TRUE,FALSE,FALSE,9a1c2a36-e5b8-459e-840a-7835f925e06c,Greater London,Greater London
https://data.london.gov.uk/dataset/languages-spoken-pupils-borough-msoa,4ed47645-83eb-4089-8a58-80cdb00ac247,languages-spoken-pupils-borough-msoa,"Languages Spoken by Pupils, Borough & MSOA",active,public,08-Aug-11,04-Jul-14,UK Open Government Licence (OGL v2),,London Borough of Newham,,Greater London Authority,,Opinion Research and General Statistics (GLA),datastore@london.gov.uk,Ad hoc,https://certificates.theodi.org/datasets/22997/certificate,"language, pupils, diversity, schools",FALSE,FALSE,FALSE,TRUE,TRUE,FALSE,FALSE,FALSE,FALSE,FALSE,FALSE,FALSE,FALSE,FALSE,FALSE,TRUE,FALSE,215702e3-0b5f-4a09-b332-0eac760b48ad,Output Area,Greater London
https://data.london.gov.uk/dataset/public-toilets,d988ad6a-7a13-418d-8e44-94a2ce5c6da2,public-toilets,Public Toilets,active,public,05-Jul-11,04-Jul-14,UK Open Government Licence (OGL v2),,Greater London Authority (GLA),,Greater London Authority,,London Assembly Scrutiny Team,scrutiny@london.gov.uk,Ad hoc,https://certificates.theodi.org/datasets/23000/certificate,"public-toilets, toilets",FALSE,TRUE,FALSE,FALSE,FALSE,FALSE,FALSE,TRUE,FALSE,FALSE,FALSE,FALSE,FALSE,TRUE,FALSE,FALSE,FALSE,5b858cb2-5c92-4b2b-8c1d-141cfc330d9c,Local Authority,Greater London
https://data.london.gov.uk/dataset/ordnance-survey-opendata,62c08c7b-20c6-4e3d-bdbb-dc50f0943682,ordnance-survey-opendata,Ordnance Survey OpenData,active,public,10-Jun-11,04-Jul-14,UK Open Government Licence (OGL v2),<http://www.ordnancesurvey.co.uk/oswebsite/opendata/docs/os-opendata-licence.pdf>,Ordnance Survey,,Ordnance Survey,,Opinion Research and General Statistics (GLA),datastore@london.gov.uk,Ad hoc,https://certificates.theodi.org/datasets/22998/certificate,"gis, geo, maps",FALSE,FALSE,FALSE,FALSE,FALSE,FALSE,FALSE,FALSE,FALSE,FALSE,FALSE,FALSE,FALSE,TRUE,FALSE,FALSE,FALSE,f9b316b5-aa7f-4f9f-9d86-05acad72b66e,,National
https://data.london.gov.uk/dataset/alternative-vote-referendum-results-borough,85724d08-c755-4737-8bc4-d5a00d05bd87,alternative-vote-referendum-results-borough,"Alternative Vote referendum results, Borough",active,public,11-May-11,04-Jul-14,UK Open Government Licence (OGL v2),,Greater London Authority (GLA),,Greater London Authority,,Opinion Research and General Statistics (GLA),datastore@london.gov.uk,Ad hoc,https://certificates.theodi.org/datasets/23002/certificate,elections,FALSE,FALSE,FALSE,FALSE,FALSE,FALSE,FALSE,FALSE,FALSE,FALSE,FALSE,FALSE,FALSE,TRUE,FALSE,FALSE,FALSE,5b858cb2-5c92-4b2b-8c1d-141cfc330d9c,Local Authority,UK
https://data.london.gov.uk/dataset/street-trees-borough,f3d826c0-b707-4cd4-becc-60db7f2d3475,street-trees-borough,"Street Trees, Borough",active,public,19-Apr-11,04-Jul-14,UK Open Government Licence (OGL v2),,Greater London Authority (GLA),,Greater London Authority,,Opinion Research and General Statistics (GLA),datastore@london.gov.uk,Ad hoc,https://certificates.theodi.org/datasets/22999/certificate,"environment, trees",FALSE,FALSE,FALSE,FALSE,FALSE,FALSE,TRUE,FALSE,FALSE,FALSE,FALSE,FALSE,FALSE,FALSE,FALSE,FALSE,FALSE,5b858cb2-5c92-4b2b-8c1d-141cfc330d9c,Local Authority,Greater London
https://data.london.gov.uk/dataset/london-empty-homes-audit,4490acc8-4d3a-429f-aab5-64c8af167781,london-empty-homes-audit,London Empty Homes Audit,active,public,10-Jan-12,04-Jul-14,UK Open Government Licence (OGL v2),,Greater London Authority (GLA),,Greater London Authority,,Census Team (GLA),census@london.gov.uk,Ad hoc,https://certificates.theodi.org/datasets/23003/certificate,"housing, private, empty, homes",FALSE,FALSE,FALSE,FALSE,FALSE,FALSE,FALSE,FALSE,TRUE,FALSE,FALSE,FALSE,FALSE,FALSE,FALSE,FALSE,FALSE,5b858cb2-5c92-4b2b-8c1d-141cfc330d9c,Postcode Sector,Greater London
https://data.london.gov.uk/dataset/london-elections-results-2000,cd90a1c9-6dcc-45cc-a2ea-3291e4f68873,london-elections-results-2000,"London Elections Results, 2000",active,public,24-Jan-11,04-Jul-14,UK Open Government Licence (OGL v2),,Greater London Authority (GLA),,Greater London Authority,,Opinion Research and General Statistics (GLA),datastore@london.gov.uk,Ad hoc,https://certificates.theodi.org/datasets/23001/certificate,elections,FALSE,FALSE,FALSE,FALSE,FALSE,FALSE,FALSE,FALSE,FALSE,FALSE,FALSE,FALSE,FALSE,TRUE,FALSE,FALSE,FALSE,5b858cb2-5c92-4b2b-8c1d-141cfc330d9c,GLA Constituency,Greater London
https://data.london.gov.uk/dataset/tfl-expenditure,582581ba-8d0c-4d58-871f-7f44bdabe60a,tfl-expenditure,TfL Expenditure Over £500,active,public,14-Feb-11,04-Jul-14,UK Open Government Licence (OGL v2),,Transport for London (TfL),,Transport for London,,Financial Services Centre,,Ad hoc,https://certificates.theodi.org/datasets/23005/certificate,"services, expenditure, suppliers, finance, spending, payments, goods, transparency",FALSE,FALSE,FALSE,FALSE,FALSE,FALSE,FALSE,FALSE,FALSE,FALSE,FALSE,FALSE,FALSE,TRUE,TRUE,FALSE,FALSE,9a1c2a36-e5b8-459e-840a-7835f925e06c,,Greater London
https://data.london.gov.uk/dataset/wandsworth-open-data,c59a0343-6175-458e-87b9-69516ba16bf3,wandsworth-open-data,Wandsworth Open Data,active,public,10-Feb-11,04-Jul-14,UK Open Government Licence (OGL v2),,London Borough of Wandsworth,,London Borough of Wandsworth,,London Borough of Wandsworth,,Ad hoc,https://certificates.theodi.org/datasets/23006/certificate,"waste, expenditure, post-offices, schools, gritting, libraries, geo, toilets",FALSE,FALSE,FALSE,FALSE,FALSE,FALSE,FALSE,FALSE,FALSE,FALSE,FALSE,FALSE,FALSE,TRUE,FALSE,FALSE,FALSE,600417b5-842a-470a-bf25-4f9216b35ce9,Local Authority,London Borough of Wandsworth
https://data.london.gov.uk/dataset/london-elections-results-2012-wards-boroughs-constituency,9c111b77-13eb-4257-908d-aef103615078,london-elections-results-2012-wards-boroughs-constituency,"London Elections Results 2012, Wards, Boroughs, Constituency",active,public,08-May-12,04-Jul-14,UK Open Government Licence (OGL v2),,Greater London Authority (GLA),,Greater London Authority,,Opinion Research and General Statistics (GLA),datastore@london.gov.uk,Ad hoc,https://certificates.theodi.org/datasets/23009/certificate,"assembly, elections, mayoral, poll, votes",FALSE,FALSE,FALSE,FALSE,FALSE,FALSE,FALSE,FALSE,FALSE,FALSE,FALSE,FALSE,FALSE,TRUE,FALSE,FALSE,FALSE,5b858cb2-5c92-4b2b-8c1d-141cfc330d9c,Ward,Greater London
https://data.london.gov.uk/dataset/londoners-reduced-mobility,51589c30-9151-43fb-a269-827363ac3c7f,londoners-reduced-mobility,Estimated Number of Londoners with Reduced Mobility,active,public,25-Nov-10,04-Jul-14,UK Open Government Licence (OGL v2),,Greater London Authority (GLA),,Greater London Authority,,Opinion Research and General Statistics (GLA),datastore@london.gov.uk,Ad hoc,https://certificates.theodi.org/datasets/23015/certificate,"accessibility, transport, reduced-mobility, demography, population, disability",FALSE,FALSE,FALSE,TRUE,FALSE,FALSE,FALSE,FALSE,FALSE,FALSE,FALSE,FALSE,FALSE,FALSE,TRUE,FALSE,FALSE,5b858cb2-5c92-4b2b-8c1d-141cfc330d9c,Local Authority,Greater London
https://data.london.gov.uk/dataset/allotment-locations,16053893-57cd-4051-92f2-57283229c491,allotment-locations,Allotment Locations,active,public,01-Sep-10,04-Jul-14,UK Open Government Licence (OGL v2),"This dataset was generated from a variety of sources with the core attribute data such as Name, Borough and Organisation being provided by the London Boroughs.

The process of geocoding was carried out manually using a number of different datasets to provide location context. These include Collins-Bartholomew 20k raster mapping, Cities Revealed aerial photography, Ordnance Survey 10k raster and MasterMap.

We do not believe that there are any derived data issues relating to the coordinate information (easting, northing, latitude and longitude) for allotment locations as these were geocoded manually without snapping to any vector information.
",Greater London Authority (GLA),,Greater London Authority,,Opinion Research and General Statistics (GLA),datastore@london.gov.uk,Ad hoc,https://certificates.theodi.org/datasets/23018/certificate,"allotments, food, geo",FALSE,FALSE,FALSE,FALSE,FALSE,FALSE,TRUE,FALSE,FALSE,FALSE,FALSE,FALSE,FALSE,FALSE,FALSE,FALSE,FALSE,5b858cb2-5c92-4b2b-8c1d-141cfc330d9c,Point Location,Greater London
https://data.london.gov.uk/dataset/age-commercial-and-industrial-stock-borough,b4abb5a5-ec4c-48b0-abad-d7a18ac7c831,age-commercial-and-industrial-stock-borough,"Age of Commercial and Industrial Stock, Borough",active,public,19-Aug-10,04-Jul-14,UK Open Government Licence (OGL v2),,"Ministry of Housing, Communities & Local Government (MHCLG)",,Department for Communities and Local Government,,Opinion Research and General Statistics (GLA),datastore@london.gov.uk,Ad hoc,https://certificates.theodi.org/datasets/23023/certificate,"age, commercial, stock, industrial, planning, property",FALSE,FALSE,FALSE,FALSE,FALSE,FALSE,TRUE,FALSE,FALSE,FALSE,FALSE,TRUE,FALSE,FALSE,FALSE,FALSE,FALSE,8070677a-2a67-4103-9cf6-d7764d1a9593,Local Authority,Greater London
https://data.london.gov.uk/dataset/land-use-change-dwellings-borough,8fe3f7d3-99c4-4454-825a-561828273b9f,land-use-change-dwellings-borough,"Land Use Change for Dwellings, Borough",active,public,19-Aug-10,04-Jul-14,UK Open Government Licence (OGL v2),,"Ministry of Housing, Communities & Local Government (MHCLG)",,Department for Communities and Local Government,,Opinion Research and General Statistics (GLA),datastore@london.gov.uk,Ad hoc,https://certificates.theodi.org/datasets/23022/certificate,"dwellings, development, new-dwellings, density, housing, land-use, house-building",FALSE,FALSE,FALSE,FALSE,FALSE,FALSE,TRUE,FALSE,TRUE,FALSE,FALSE,TRUE,FALSE,FALSE,FALSE,FALSE,FALSE,8070677a-2a67-4103-9cf6-d7764d1a9593,Local Authority,Greater London
https://data.london.gov.uk/dataset/key-stage-3-results-location-pupil-residence-borough,f0bfb20c-93b5-42a9-a64c-246aa12aa4f8,key-stage-3-results-location-pupil-residence-borough,"Key Stage 3 Results by Location of Pupil Residence, Borough",active,public,19-Aug-10,04-Jul-14,UK Open Government Licence (OGL v2),,Department for Education,,Department for Education,,Opinion Research and General Statistics (GLA),datastore@london.gov.uk,Ad hoc,https://certificates.theodi.org/datasets/23026/certificate,"residence, education, ks3, pupils, attainment",FALSE,FALSE,FALSE,FALSE,TRUE,FALSE,FALSE,FALSE,FALSE,FALSE,FALSE,FALSE,FALSE,FALSE,FALSE,FALSE,FALSE,f1e2d47c-3d52-4413-b376-ba05a0d00bfa,Local Authority,Greater London
https://data.london.gov.uk/dataset/smoothed-age-specific-fertility-rates-london-boroughs-and-borough-groupings-2005-0,56c6ac27-0369-404e-8b97-db2617d7a293,smoothed-age-specific-fertility-rates-london-boroughs-and-borough-groupings-2005-0,Smoothed age-specific fertility rates for London boroughs and borough groupings 2005-07,active,public,17-Aug-10,04-Jul-14,UK Open Government Licence (OGL v2),,Greater London Authority (GLA),,Greater London Authority,,Demography Team (GLA),demography@london.gov.uk,Ad hoc,https://certificates.theodi.org/datasets/23031/certificate,"population, single-year-of-age",FALSE,FALSE,FALSE,TRUE,FALSE,FALSE,FALSE,FALSE,FALSE,FALSE,FALSE,FALSE,FALSE,FALSE,FALSE,FALSE,FALSE,5b858cb2-5c92-4b2b-8c1d-141cfc330d9c,Local Authority,Greater London
https://data.london.gov.uk/dataset/raw-age-specific-fertility-rates-london-boroughs-and-borough-groupings-2005-07,425adaaa-84c5-4583-a36e-e4f50997651d,raw-age-specific-fertility-rates-london-boroughs-and-borough-groupings-2005-07,Raw age-specific fertility rates for London boroughs and borough groupings 2005-07,active,public,17-Aug-10,04-Jul-14,UK Open Government Licence (OGL v2),,Greater London Authority (GLA),,Greater London Authority,,Demography Team (GLA),demography@london.gov.uk,Ad hoc,https://certificates.theodi.org/datasets/23036/certificate,"population, single-year-of-age",FALSE,FALSE,FALSE,TRUE,FALSE,FALSE,FALSE,FALSE,FALSE,FALSE,FALSE,FALSE,FALSE,FALSE,FALSE,FALSE,FALSE,5b858cb2-5c92-4b2b-8c1d-141cfc330d9c,Local Authority,Greater London
https://data.london.gov.uk/dataset/laei-2008-concentration-maps,3988a81a-700d-47bf-9feb-775ee4b21fe6,laei-2008-concentration-maps,London Atmospheric Emissions Inventory (LAEI) 2008 Concentration Maps,active,public,12-Aug-10,04-Jul-14,UK Open Government Licence (OGL v2),,Greater London Authority (GLA),,Air Quality Team (GLA),,Air Quality Team (GLA),,Annually,https://certificates.theodi.org/datasets/23040/certificate,"concentration, laei, nitrogen-dioxide, particulate-matter, air-pollution",FALSE,FALSE,FALSE,FALSE,FALSE,FALSE,TRUE,FALSE,FALSE,FALSE,FALSE,FALSE,FALSE,FALSE,FALSE,FALSE,FALSE,5b858cb2-5c92-4b2b-8c1d-141cfc330d9c,20 Metre Grid,Greater London
https://data.london.gov.uk/dataset/country-birth-2001-census-detailed-borough,e7330e0d-3856-48b9-a12a-45ab71bbc30d,country-birth-2001-census-detailed-borough,"Country of Birth (2001 Census) - Detailed, Borough",active,public,09-Aug-10,04-Jul-14,UK Open Government Licence (OGL v2),,Office for National Statistics (ONS),,Office for National Statistics,,Census Team (GLA),census@london.gov.uk,Ad hoc,https://certificates.theodi.org/datasets/23037/certificate,"diversity, immigration, population, country-of-birth",FALSE,FALSE,FALSE,TRUE,FALSE,FALSE,FALSE,FALSE,FALSE,FALSE,FALSE,FALSE,FALSE,FALSE,FALSE,FALSE,FALSE,2b9d2485-1e5a-4b9b-922c-a2a4d42a864a,Local Authority,Greater London
https://data.london.gov.uk/dataset/indices-multiple-deprivation-borough,4bb72fa2-1f9d-455b-a692-e85c1ef906ca,indices-multiple-deprivation-borough,"Indices of Multiple Deprivation, Borough",active,public,27-Jul-10,04-Jul-14,UK Open Government Licence (OGL v2),,"Ministry of Housing, Communities & Local Government (MHCLG)",,Department for Communities and Local Government,,Opinion Research and General Statistics (GLA),datastore@london.gov.uk,Ad hoc,https://certificates.theodi.org/datasets/23046/certificate,"inequality, employment, poverty, worklessness, deprivation, index",FALSE,FALSE,FALSE,TRUE,FALSE,TRUE,FALSE,FALSE,FALSE,FALSE,FALSE,FALSE,FALSE,FALSE,FALSE,FALSE,FALSE,8070677a-2a67-4103-9cf6-d7764d1a9593,Local Authority,Greater London
https://data.london.gov.uk/dataset/changes-ownership-dwelling-price-borough,ab4f498c-f133-4d6b-8d8e-69eb532620c6,changes-ownership-dwelling-price-borough,"Changes of Ownership by Dwelling Price, Borough",active,public,19-Jul-10,04-Jul-14,UK Open Government Licence (OGL v2),,"Ministry of Housing, Communities & Local Government (MHCLG)",,Department for Communities and Local Government,,Opinion Research and General Statistics (GLA),datastore@london.gov.uk,Annually,https://certificates.theodi.org/datasets/23047/certificate,"real-estate, ownership, house-prices, transactions, dwellings, property",FALSE,FALSE,FALSE,FALSE,FALSE,FALSE,FALSE,FALSE,FALSE,FALSE,FALSE,TRUE,FALSE,FALSE,FALSE,FALSE,FALSE,8070677a-2a67-4103-9cf6-d7764d1a9593,Local Authority,Greater London
https://data.london.gov.uk/dataset/2010-2013-gla-budget-detail,a07fd5fc-88d6-4a0e-940b-03f0743e569b,2010-2013-gla-budget-detail,2010-2013 GLA budget detail,active,public,19-Jul-10,04-Jul-14,UK Open Government Licence (OGL v2),,Greater London Authority (GLA),,Greater London Authority,,Opinion Research and General Statistics (GLA),datastore@london.gov.uk,Annually,https://certificates.theodi.org/datasets/23050/certificate,"transparency, resources, expenditure, finance, budget",FALSE,FALSE,FALSE,FALSE,FALSE,FALSE,FALSE,FALSE,FALSE,FALSE,FALSE,FALSE,FALSE,TRUE,FALSE,FALSE,FALSE,5b858cb2-5c92-4b2b-8c1d-141cfc330d9c,Greater London,
https://data.london.gov.uk/dataset/physically-active-children-borough,e972382c-2a55-4a5f-babe-8265ee2d1981,physically-active-children-borough,"Physically Active Children, Borough",active,public,05-Jul-10,04-Jul-14,UK Open Government Licence (OGL v2),,Department for Education,,Department for Education,,Opinion Research and General Statistics (GLA),datastore@london.gov.uk,Annually,https://certificates.theodi.org/datasets/23051/certificate,"active, children, exercise, physical-education, sport",FALSE,FALSE,FALSE,FALSE,FALSE,FALSE,FALSE,TRUE,FALSE,FALSE,FALSE,FALSE,TRUE,FALSE,FALSE,FALSE,FALSE,f1e2d47c-3d52-4413-b376-ba05a0d00bfa,Local Authority,Greater London
